Account / 账号,Nickname / 昵称,Screenshot Name / 截图名称,Rank in Account / 账号内排序,Drama ID / 短剧ID,English Title / 英文剧名,Chinese Title / 中文剧名,Publish Time / 发布时间,Episodes / 集数,Views / 观看数,Duration Seconds / 总时长(秒),Duration Minutes / 总时长(分钟),Limited Free / 是否限免,English Themes / 英文题材,Chinese Themes / 中文题材,English Description Preview / 英文简介预览,Chinese Description / 中文简介,Description Truncated / 简介是否截断,Source Profile URL / 来源主页
drama.pro28,The Lore Master,The Lore Master,20,ID 7647882882341639186,The Falling Star's Ultimatum,流星的最后通牒,2026-06-07 20:06:34,30,4010255,1734,28.9,是 / Yes,Cultivation、Redemption、Political Intrigue,栽培、赎回、政治阴谋,The Falling Star's Ultimatum,,否 / No,https://www.tiktok.com/@drama.pro28
drama.pro28,The Lore Master,The Lore Master,21,ID 7639357288775685141,Unchained Tides: The Siren They Couldn't Break,不受束缚的潮汐：他们无法打破的海妖,2026-05-14 21:23:44,26,23372046,1993,33.2,是 / Yes,Mistaken Identities、Adventure、Fantasy,错误的身份、冒险、奇幻,"A marine biologist infiltrates a brutal underground aquarium and discovers its star captive isn't a genetic hoax — she's the last living mermaid, her blood holds the secret to immortality, and falling for her could drown them both.",,否 / No,https://www.tiktok.com/@drama.pro28
drama.pro28,The Lore Master,The Lore Master,22,ID 7655348411968967688,Nine Lives Nine Black Belts,九命九黑带,2026-06-25 23:05:56,20,465908,2085,34.8,是 / Yes,Fantasy、Action,奇幻、行动,"A stray orange cat swallows lightning-struck ramen broth and unlocks nine deadly kung fu styles — one per life — teaming up with a broke, hot-tempered ex-boxer to fist-fight their way through New York's nastiest debt collectors before all nine lives burn out.",,否 / No,https://www.tiktok.com/@drama.pro28
drama.pro28,The Lore Master,The Lore Master,23,ID 7640529526480753684,Executions of the Lone Overlord,处决孤独霸主,2026-05-18 06:32:37,10,1613085,608,10.1,是 / Yes,Revenge、Challenge/Quests in Game、Love Triangle,复仇、游戏中的挑战/任务、三角恋,Executions of the Lone Overlord,,否 / No,https://www.tiktok.com/@drama.pro28
drama.pro28,The Lore Master,The Lore Master,24,ID 7654251256902554642,Substitute Star,替补明星,2026-06-23 00:07:50,51,882242,3278,54.6,是 / Yes,Mistaken Identities、Celebrity、Revenge,错误的身份、名人、复仇,A double avenges being framed by swapping lives and exposing the star.,,否 / No,https://www.tiktok.com/@drama.pro28
drama.pro28,The Lore Master,The Lore Master,25,ID 7654251118251267079,My House is a Mimic,我的房子是一个模仿者,2026-06-23 00:05:51,31,363161,1584,26.4,是 / Yes,Mystery、Fantasy,神秘、奇幻,"A man finds his house is sentient, defends it from demolition, shelters other magical buildings.",,否 / No,https://www.tiktok.com/@drama.pro28
drama.pro28,The Lore Master,The Lore Master,26,ID 7653493052673692679,"Hobo Swallows Iron, NYC Kneels",流浪汉吞下铁，纽约下跪,2026-06-20 23:06:09,24,823829,1704,28.4,是 / Yes,Action、City,行动、城市,"Hobo Swallows Iron, NYC Kneels",,否 / No,https://www.tiktok.com/@drama.pro28
drama.pro28,The Lore Master,The Lore Master,27,ID 7645777364060656660,Mythic Tamer: Rise of the Trash Summon,神话驯兽师：垃圾召唤的崛起,2026-05-31 13:04:08,25,450567,1870,31.2,是 / Yes,Challenge/Quests in Game、Love Triangle、Revenge,游戏中的挑战/任务、三角恋、复仇,Mythic Tamer: Rise of the Trash Summon,,否 / No,https://www.tiktok.com/@drama.pro28
drama.pro28,The Lore Master,The Lore Master,28,ID 7644164396910138388,Kiss.exe Has Been Activated!,Kiss.exe已激活！,2026-05-31 10:38:09,20,527547,1574,26.2,是 / Yes,Revenge、Fantasy、Love Triangle,复仇、奇幻、三角恋,"A kiss-triggered program awakens and turns romance into a glitchy battle between love, control, and chaos.",,否 / No,https://www.tiktok.com/@drama.pro28
drama.pro28,The Lore Master,The Lore Master,29,ID 7640369785984947208,The Prince Who Kisses Me Only at Midnight,只在午夜亲吻我的王子,2026-06-29 23:31:34,30,420492,1636,27.3,是 / Yes,Fantasy、dark romance、Romantic Complications,奇幻、黑暗浪漫、浪漫并发症,"Every midnight, a Victorian prince walks out of her mirror to kiss her. Every kiss steals one year of her life and buys him one minute of freedom. She knows loving him will kill her. She sets the alarm anyway.",,否 / No,https://www.tiktok.com/@drama.pro28
drama.pro28,The Lore Master,The Lore Master,30,ID 7650346917481993234,Bound by the Scar,被伤疤所束缚,2026-06-12 11:36:54,40,869240,2264,37.7,是 / Yes,Werewolf、Adventure,狼人、冒险,Bound by the Scar,,否 / No,https://www.tiktok.com/@drama.pro28
drama.pro28,The Lore Master,The Lore Master,31,ID 7639314184873972737,The Archmage's Rebirth,大法师的重生,2026-05-14 09:37:16,10,482012,880,14.7,是 / Yes,Revenge、Challenge/Quests in Game,复仇、游戏中的挑战/任务,The Archmage's Rebirth,,否 / No,https://www.tiktok.com/@drama.pro28
drama.pro28,The Lore Master,The Lore Master,32,ID 7654251010734953490,The Wolf Throne,狼王座,2026-06-23 00:06:32,50,3908776,5314,88.6,是 / Yes,Mistaken Identities、Revenge、Royal Palace,错误的身份、复仇、皇宫,The Wolf Throne,,否 / No,https://www.tiktok.com/@drama.pro28
drama.pro28,The Lore Master,The Lore Master,33,ID 7656901076352029703,Lord Sinclair: The Poor Driver's Secret,辛克莱勋爵：可怜司机的秘密,2026-06-30 03:29:34,53,340024,4512,75.2,是 / Yes,Cultivation、Redemption、Romantic Complications,栽培、赎回、浪漫并发症,Lord Sinclair: The Poor Driver's Secret,,否 / No,https://www.tiktok.com/@drama.pro28
drama.pro28,The Lore Master,The Lore Master,34,ID 7638365976530293781,Trapping the Sin-Maid,诱捕罪女,2026-05-11 11:03:47,29,8260463,1656,27.6,是 / Yes,Revenge、Vampire,复仇、吸血鬼,Trapping the Sin-Maid,,否 / No,https://www.tiktok.com/@drama.pro28
drama.pro28,The Lore Master,The Lore Master,35,ID 7655348846830261266,Portal Hunter,传送门猎人,2026-06-25 23:07:49,60,794586,3861,64.3,是 / Yes,Lost Child、Action、Fantasy,丢失的孩子、行动、奇幻,Portal Hunter,,否 / No,https://www.tiktok.com/@drama.pro28
drama.pro28,The Lore Master,The Lore Master,36,ID 7645880449717310472,The Vine Mother,葡萄树妈妈,2026-06-01 01:59:22,31,9526606,1669,27.8,是 / Yes,End-of-the-World、Lost Child、Revenge,世界末日、丢失的孩子、复仇,A mother fights her cruel captors to protect her plant-child in the apocalypse.,,否 / No,https://www.tiktok.com/@drama.pro28
drama.pro28,The Lore Master,The Lore Master,37,ID 7650346861983257608,Midnight Anchor,午夜锚,2026-06-12 11:36:37,40,321924,2336,38.9,是 / Yes,Mystery、Fantasy,神秘、奇幻,Midnight Anchor,,否 / No,https://www.tiktok.com/@drama.pro28
drama.pro28,The Lore Master,The Lore Master,38,ID 7651498070064190471,Revenge of the Pregnant Seahorse,怀孕海马的复仇,2026-06-15 14:04:00,50,418633532,2991,49.9,是 / Yes,Revenge、Family Feud、Reconciliation,复仇、家庭恩怨、和解,Revenge of the Pregnant Seahorse,,否 / No,https://www.tiktok.com/@drama.pro28
drama.pro28,The Lore Master,The Lore Master,39,ID 7655332933607363591,OLYMPUS ZERO: The Gods Are Already Dead,奥林匹斯零：众神已死,2026-06-25 22:06:22,20,1429318,2224,37.1,是 / Yes,Cultivation、Adventure,栽培、冒险,"A college girl gets sucked into Mount Olympus — but every god is now a zombie that still has their powers, and she's the only human alive in a heaven that's rotting from the inside out.",,否 / No,https://www.tiktok.com/@drama.pro28
drama.pro28,The Lore Master,The Lore Master,40,ID 7650349237095502855,"They Buried the Beast, But He Dug His Way Out",他们埋葬了野兽，但他却挖出了出路,2026-06-12 11:46:02,22,4447061,1936,32.3,是 / Yes,Revenge、Cultivation,复仇、栽培,Beast digs his way out,,否 / No,https://www.tiktok.com/@drama.pro28
drama.pro28,The Lore Master,The Lore Master,41,ID 7620813949222573087,She Rules the Ruins,她统治着废墟,2026-05-29 22:41:38,50,363000,3609,60.1,是 / Yes,Family Disputes、Fantasy、Lost Child,家庭纠纷、奇幻、丢失的孩子,She Rules the Ruins. to revenge,,否 / No,https://www.tiktok.com/@drama.pro28
drama.pro28,The Lore Master,The Lore Master,42,ID 7654265811636442130,Ghost Orchid: The Elf King's Obsession,幽灵兰：精灵王的痴迷,2026-06-23 01:03:23,51,812350,4415,73.6,是 / Yes,Cultivation、Contract Lovers、Married Life,栽培、合约爱好者、婚姻生活,Ghost Orchid: The Elf King's Obsession,,否 / No,https://www.tiktok.com/@drama.pro28
drama.pro28,The Lore Master,The Lore Master,43,ID 7653786497623200786,Prometheus The Fire Thief in Silicon Valley,硅谷的火盗普罗米修斯,2026-06-21 18:02:41,31,449280,2073,34.5,是 / Yes,Action、City,行动、城市,Leon creates free AI and fights reincarnated gods with policewoman Ava.,,否 / No,https://www.tiktok.com/@drama.pro28
drama.pro28,The Lore Master,The Lore Master,44,ID 7650346950767760392,The Shadow Lord's Substitute Bride,暗影领主的替身新娘,2026-06-12 11:36:52,30,857188,1809,30.1,是 / Yes,Mistaken Identities、First Love & Substitute、Fantasy,错误的身份、初恋与替身、奇幻,The Shadow Lord's Substitute Bride,,否 / No,https://www.tiktok.com/@drama.pro28
drama.pro28,The Lore Master,The Lore Master,45,ID 7643329262229099536,I Woke Up in the Wrong Mythology,我在错误的神话中醒来,2026-05-26 00:17:20,20,3061794,1984,33.1,是 / Yes,Adventure、Redemption、Multiverse,冒险、赎回、多元宇宙,"A chronically insomniac librarian falls asleep in a mythology section and wakes up INSIDE a different myth every single day—Vikings, Greek gods, Egyptian tombs—and must escape before sunset or be trapped in legend forever, while a mysterious blue-eyed stranger appears in every world wearing a different face.",,否 / No,https://www.tiktok.com/@drama.pro28
drama.pro28,The Lore Master,The Lore Master,46,ID 7656912062085698567,The Abyssal Duke’s Pearl Queen,深渊公爵的珍珠女王,2026-06-30 04:13:50,40,332527,3705,61.8,是 / Yes,Royal Palace、Redemption、Family Disputes,皇宫、赎回、家庭纠纷,The Abyssal Duke’s Pearl Queen,,否 / No,https://www.tiktok.com/@drama.pro28
drama.pro28,The Lore Master,The Lore Master,47,ID 7645849485742314512,Betrayed by the Stars,被星星背叛,2026-06-01 00:08:13,30,528996,1757,29.3,是 / Yes,Revenge、Fantasy、Love Triangle,复仇、奇幻、三角恋,Betrayed by the Stars,,否 / No,https://www.tiktok.com/@drama.pro28
drama.pro28,The Lore Master,The Lore Master,48,ID 7643272758042809345,The Botanist Who Seduced The Plant King,引诱植物王的植物学家,2026-05-25 21:35:25,20,5748712,1707,28.4,是 / Yes,dark romance、Romantic Complications、Fantasy,黑暗浪漫、浪漫并发症、奇幻,"Every plant on Earth woke up hungry, angry, and ready to kill — skyscrapers strangled by vines, sunflowers firing explosive seeds like cannons — and the only woman who can hear them speak just discovered the Plant King doesn't want peace, he wants her heart, literally and figuratively.",,否 / No,https://www.tiktok.com/@drama.pro28
drama.pro28,The Lore Master,The Lore Master,49,ID 7645808130961544209,Cupid’s Broken Arrow,丘比特的断箭,2026-05-31 20:44:11,31,517416,1666,27.8,是 / Yes,Romantic Complications、Fantasy、Love Triangle,浪漫并发症、奇幻、三角恋,God descends to mortal world and falls into irreversible true love,,否 / No,https://www.tiktok.com/@drama.pro28
drama.pro28,The Lore Master,The Lore Master,50,ID 7656958479114392583,Midnight Anchor,午夜锚,2026-06-30 07:12:17,40,322316,2336,38.9,是 / Yes,Mystery、Redemption、Fantasy,神秘、赎回、奇幻,Midnight Anchor,,否 / No,https://www.tiktok.com/@drama.pro28
drama.pro28,The Lore Master,The Lore Master,51,ID 7638350759637193748,"Reborn in Wonderland, I Woke Up With Powers",重生在仙境，醒来时拥有力量,2026-05-11 06:10:50,30,3692534,1678,28.0,是 / Yes,Redemption、Fantasy、Revenge,赎回、奇幻、复仇,"Reborn in Wonderland, I Woke Up With Powers",,否 / No,https://www.tiktok.com/@drama.pro28
drama.pro28,The Lore Master,The Lore Master,52,ID 7569901831745279007,The Prince's Serpent Bride,王子的蛇新娘,2025-11-07 22:58:20,26,43533464,2068,34.5,是 / Yes,Revenge、Fantasy,复仇、奇幻,He's an elf prince CEO. She's his pregnant Medusa maid. Questions?,,否 / No,https://www.tiktok.com/@drama.pro28
drama.pro28,The Lore Master,The Lore Master,53,ID 7611519412713264158,"Dated by the Knight, Hunted by the Gods",被骑士约会，被众神追捕,2026-03-01 09:44:43,29,11315551,2000,33.3,是 / Yes,Cultivation、Love Triangle、Adventure,栽培、三角恋、冒险,My Blood Awakened the Abyss Lord,,否 / No,https://www.tiktok.com/@drama.pro28
drama.pro28,The Lore Master,The Lore Master,54,ID 7604498059464266783,QUEEN MEDUSA,美杜莎女王,2026-02-12 20:03:30,20,60999153,1510,25.2,是 / Yes,Revenge、Ensemble Cast、Fantasy,复仇、群像、奇幻,Monster babies. A toxic ex. A war of the gods. Who rules the seas?,,否 / No,https://www.tiktok.com/@drama.pro28
drama.pro28,The Lore Master,The Lore Master,55,ID 7572184257880232991,Snail Girl,蜗牛女孩,2025-11-14 20:58:42,5,38371412,315,5.2,是 / Yes,Revenge、Redemption、Fantasy,复仇、赎回、奇幻,A magical snail girl enslaved by a greedy man returns with her tribe to burn his town and unleash an army of flesh-eating snails in this dark fantasy revenge tale 🐚🔥,,否 / No,https://www.tiktok.com/@drama.pro28
drama.pro28,The Lore Master,The Lore Master,56,ID 7614532575561913374,My World Betrays Me,我的世界背叛了我,2026-03-11 09:54:19,49,4730028,3439,57.3,是 / Yes,Ensemble Cast、Revenge、Cultivation,群像、复仇、栽培,"My World Betrays Me, But I learn to fight",,否 / No,https://www.tiktok.com/@drama.pro28
drama.pro28,The Lore Master,The Lore Master,57,ID 7594424241987261470,My boyfriend is a fish,我的男朋友是一条鱼,2026-01-14 16:04:23,4,61448107,343,5.7,是 / Yes,Fantasy、Love Triangle、Betrayal,奇幻、三角恋、背叛,She drowned human. She woke up princess.,,否 / No,https://www.tiktok.com/@drama.pro28
drama.pro28,The Lore Master,The Lore Master,58,ID 7585162895588119583,The Mind Reading Knight,读心骑士,2025-12-19 21:40:39,5,1659819,289,4.8,是 / Yes,Betrayal、Fantasy、Enemies to Lovers,背叛、奇幻、从敌人到恋人,Reading mind in ANY time.,,否 / No,https://www.tiktok.com/@drama.pro28
drama.pro28,The Lore Master,The Lore Master,59,ID 7593603926201603103,Bound to The Forbidden,绑定到禁忌,2026-01-13 20:43:48,5,860131,414,6.9,是 / Yes,Cultivation、Love After Marriage、Betrayal,栽培、婚后的爱情、背叛,Mind reader falling in love in mile high.,,否 / No,https://www.tiktok.com/@drama.pro28
drama.pro28,The Lore Master,The Lore Master,60,ID 7568457063823840286,Blood and Crown,血与王冠,2025-11-03 23:18:29,5,9958088,413,6.9,是 / Yes,Cultivation、Redemption、Adventure,栽培、赎回、冒险,Human greed stirs blood and chaos,,否 / No,https://www.tiktok.com/@drama.pro28
drama.pro28,The Lore Master,The Lore Master,61,ID 7606734132869338143,The Princess’ Secret Guard,公主的秘密卫士,2026-02-19 09:57:42,18,289289535,1561,26.0,是 / Yes,Betrayal、Sismance、Fantasy,背叛、西斯芒斯、奇幻,"The Princess’ Secret Guard, The Girl Who Fought Like a Man",,否 / No,https://www.tiktok.com/@drama.pro28
drama.pro28,The Lore Master,The Lore Master,62,ID 7582587162332533790,The Medusa Writer's Revenge,美杜莎作家的复仇,2025-12-12 19:57:27,10,5255393,800,13.3,是 / Yes,Fantasy、Revenge,奇幻、复仇,"Don't mess up with Hollywood's ghostwriter, especially when she is Medusa.",,否 / No,https://www.tiktok.com/@drama.pro28
drama.pro28,The Lore Master,The Lore Master,63,ID 7564730715745768478,The Holy War,圣战,2025-10-24 23:42:41,10,111742826,651,10.8,是 / Yes,Revenge、Bromance、Cultivation,复仇、兄弟情谊、栽培,"the Archangel Michael must confront his brother Lucifer, whose pride ignites a rebellion that threatens the fate of both Heaven and Humanity",,否 / No,https://www.tiktok.com/@drama.pro28
drama.pro28,The Lore Master,The Lore Master,64,ID 7606384062311486494,Beast King's Forbidden Love,兽王的禁忌之爱,2026-02-15 10:22:17,21,54596230,1361,22.7,是 / Yes,Fantasy、Revenge,奇幻、复仇,Served to the Beast and loved,,否 / No,https://www.tiktok.com/@drama.pro28
drama.pro28,The Lore Master,The Lore Master,65,ID 7638350660186051605,DoomsdayMy InfiniteLuxuryBunker,世界末日我的无限豪华地堡,2026-05-11 05:20:06,30,3728270,1766,29.4,是 / Yes,Revenge、Challenge/Quests in Game、Love Triangle,复仇、游戏中的挑战/任务、三角恋,DoomsdayMy InfiniteLuxuryBunker,,否 / No,https://www.tiktok.com/@drama.pro28
drama.pro28,The Lore Master,The Lore Master,66,ID 7624933861180527633,Healer of the Devil,恶魔的治愈者,2026-04-14 09:36:42,28,4094433,1741,29.0,是 / Yes,Family & Ethics、Royal Palace、Redemption,家庭与道德、皇宫、赎回,"Healer of the Devil, Fantasy",,否 / No,https://www.tiktok.com/@drama.pro28
drama.pro28,The Lore Master,The Lore Master,67,ID 7620785021619688478,The Cinder Throne,余烬王座,2026-04-01 11:27:14,44,12520481,2859,47.6,是 / Yes,Fantasy、Redemption、Revenge,奇幻、赎回、复仇,"The Cinder Throne, dragon Heir",,否 / No,https://www.tiktok.com/@drama.pro28
drama.pro28,The Lore Master,The Lore Master,68,ID 7598091798258455583,The Dragon Slayer Abandoned magic,屠龙者被遗弃的魔法,2026-01-23 19:09:49,6,14191573,417,7.0,是 / Yes,Revenge、Lost Child、Cultivation,复仇、丢失的孩子、栽培,God becomes a servant to save his daughter.,,否 / No,https://www.tiktok.com/@drama.pro28
drama.pro28,The Lore Master,The Lore Master,69,ID 7592472287400547359,Waking up in 3000 A.D.,在公元 3000 年醒来,2026-01-07 20:34:11,5,3122786,321,5.3,是 / Yes,Ensemble Cast、Fantasy、Adventure,群像、奇幻、冒险,Waking up in 3000 A.D. in the future,,否 / No,https://www.tiktok.com/@drama.pro28
drama.pro28,The Lore Master,The Lore Master,70,ID 7581432846615680031,Mermaid In A Manhole,沙井里的美人鱼,2025-12-09 19:17:19,5,115977024,338,5.6,是 / Yes,Fantasy、Forced Love、dark romance,奇幻、强迫的爱、黑暗浪漫,Mermaid In A Manhole,,否 / No,https://www.tiktok.com/@drama.pro28
drama.pro28,The Lore Master,The Lore Master,71,ID 7599961574648058911,Dark Edge,黑暗边缘,2026-01-30 09:42:33,5,922100,372,6.2,是 / Yes,Challenge/Quests in Game、Adventure、Lost Child,游戏中的挑战/任务、冒险、丢失的孩子,Dark Edge,,否 / No,https://www.tiktok.com/@drama.pro28
drama.pro28,The Lore Master,The Lore Master,72,ID 7598574865456878623,Medusa’s Mission,美杜莎的使命,2026-01-24 09:58:31,5,5372099,278,4.6,是 / Yes,Fantasy、Spy Drama、Contract Lovers,奇幻、谍战剧、合约爱好者,"Weird New Mission, and The Rebirth of Medusa",,否 / No,https://www.tiktok.com/@drama.pro28
duniadrama43,DuniaDrama,DuniaDrama,1,ID 7654463314029745160,Campus Magic,校园魔法,2026-06-23 13:47:52,40,319881,2089,34.8,是 / Yes,Cultivation、Superior and Inferior、Political Intrigue,栽培、强弱逆袭、政治阴谋,"In the magic-ruled Elder Continent, bloodline supremacy dominates the sacred Saint Glory Royal Magic Academy. Ryder Gray, a powerless orphan labeled a worthless curse-bearer, endures endless bullying from arrogant noble students and is reduced to a menial servant. He accidentally awakens the forbidden Void Pupil, a lost magic that can analyze, absorb and crack all spells. Hiding his power, he grows stronger in secret and forms a loyal alliance with Erin, a talented fallen noble girl. Step by step, they uncover the academy’s dark truth—senior officials steal ordinary students’ magic essence to",,否 / No,https://www.tiktok.com/@duniadrama43
duniadrama43,DuniaDrama,DuniaDrama,2,ID 7642245804916331528,The Elite Marriage,精英婚姻,2026-05-22 01:40:32,35,853673,2129,35.5,是 / Yes,Family Feud、Contract Lovers、Married Life,家庭恩怨、合约爱好者、婚姻生活,The Elite Marriage,,否 / No,https://www.tiktok.com/@duniadrama43
duniadrama43,DuniaDrama,DuniaDrama,3,ID 7654323007615226898,Silent Stake: Hidden Truth,沉默的赌注：隐藏的真相,2026-06-23 04:43:22,40,201131,2404,40.1,是 / Yes,Enemies to Lovers、Family Disputes、Family Feud,从敌人到恋人、家庭纠纷、家庭恩怨,"Clair Winston, a fallen socialite, returns with a secret equity stake, disrupting a century-old merger between two powerful clans. Cold heir Adrian Blackwood initially sees her as a threat, yet they team up amid suspicion and tension. Together, they uncover truths behind a decade-old yacht blast, family bankruptcy, and hidden dark money. Amid fierce power struggles, identity twists and intense chemistry, they fight the mysterious Silent Stakeholder pulling all strings.",,否 / No,https://www.tiktok.com/@duniadrama43
duniadrama43,DuniaDrama,DuniaDrama,4,ID 7653271129843504149,Forced Wed to a Wealthy Magnate,被迫嫁给一个富有的大亨,2026-06-20 08:41:40,62,343818,3947,65.8,是 / Yes,Redemption、Business Competition、Family Feud,赎回、商业竞赛、家庭恩怨,"Rumors spread that Elena was forced by her family to marry Adrian, a down-and-out heir, in her sister's place, while her sister took her seemingly wealthy fiancé for herself. After the marriage, she accidentally discovered that her husband was actually the ruler of a top-tier conglomerate. With her outstanding business talent, she helped him solidify his power and stage a remarkable comeback.",,否 / No,https://www.tiktok.com/@duniadrama43
duniadrama43,DuniaDrama,DuniaDrama,5,ID 7649859282912957461,Thorned Kiss Idols Revenge Darling,荆棘之吻偶像复仇亲爱的,2026-06-11 04:02:41,60,346222,3775,62.9,是 / Yes,Enemies to Lovers、Romantic Complications、Celebrity,从敌人到恋人、浪漫并发症、名人,"Sienna, a top anti-fan, publicly denounces superstar Julian, triggering a huge online storm. Forced by public pressure, she signs a fake couple contract with him and moves into his mansion. Living together, they test each other but gradually fall for each other, accidentally getting involved in a dark capital conspiracy. After betrayals, breakups and life-and-death trials, they join hands to expose the plot, clearing all grievances. Finally, the former enemies become true lovers.",,否 / No,https://www.tiktok.com/@duniadrama43
duniadrama43,DuniaDrama,DuniaDrama,6,ID 7648825022831809557,Unsilenced：Soul Slaughters,不沉默：灵魂屠杀,2026-06-08 09:08:39,39,333968,2585,43.1,是 / Yes,Courtroom Drama、City,法庭剧、城市,"Six-year-old genius Ella survives a brutal assault by a serial killer. Twenty years later, as a top prosecutor, she recognizes his signature in a new string of murders. Haunted but unbroken, Ella hunts the demon who destroyed her childhood. After a dangerous game of cat and mouse, she brings him to justice. Her ultimate triumph is not just personal vengeance; she spearheads a landmark legal reform, ensuring such predators can no longer escape the ultimate punishment. The victim becomes the architect of justice.",,否 / No,https://www.tiktok.com/@duniadrama43
duniadrama43,DuniaDrama,DuniaDrama,7,ID 7653379485659714561,My Contracted Billionaire,我的契约亿万富翁,2026-06-20 15:42:15,62,331624,3950,65.8,是 / Yes,Contract Lovers、Romantic Complications、Family Feud,合约爱好者、浪漫并发症、家庭恩怨,"A fake marriage romance about proud designer Lina Carter and controlling tycoon Ethan Blake, who enter a one year contract for money and status. What begins as a cold transaction turns into intense attraction, hidden obsession, and true love—until the controlling man falls hard for the woman he tried to own.",,否 / No,https://www.tiktok.com/@duniadrama43
duniadrama43,DuniaDrama,DuniaDrama,8,ID 7654317359964083207,The Heiress Behind His Empire,帝国背后的女继承人,2026-06-23 04:21:44,40,323894,2555,42.6,是 / Yes,Family Feud、Mistaken Identities、Family & Ethics,家庭恩怨、错误的身份、家庭与道德,"Avery Kingsley, a hidden wealthy heiress, abandons her noble identity to accompany her husband Julian to start a business and secretly pave the way for his career. Right before his company goes public, Julian looks down on Avery and files for a divorce. Heartbroken, Avery returns to take charge of the powerful Kingsley Group. Julian later realizes his so-called business empire is entirely built by Avery. Amid fierce business struggles and family intrigues, Avery breaks free from the past and becomes a strong independent leader.",,否 / No,https://www.tiktok.com/@duniadrama43
duniadrama43,DuniaDrama,DuniaDrama,9,ID 7650364154997494804,Magic Supreme,魔法至尊,2026-06-12 12:40:59,39,319836,2603,43.4,是 / Yes,Cultivation、Adventure,栽培、冒险,"When an ancient-goddess-reincarnated girl and her ""Beauty and the Beast Corps"" thwart a revenge-driven elven reincarnation plot, they discover the true enemy is a demon of words from the abyss—and this victory is merely the prelude to a greater game between divine realms and imperial ambitions.",,否 / No,https://www.tiktok.com/@duniadrama43
